{
  "schema_version": "2.0",
  "request_id": "human-request-structural-fixture",
  "case_id": "contract-fixture",
  "question_id": "Q1",
  "created_at": "2026-09-08T00:00:00Z",
  "task_signature": "aaaaaaaaaaaaaaaaaaaaaaaaaaaaaaaaaaaaaaaaaaaaaaaaaaaaaaaaaaaaaaaa",
  "task": {"path": "human_requests/human-request-structural-fixture/task.json", "sha256": "bbbbbbbbbbbbbbbbbbbbbbbbbbbbbbbbbbbbbbbbbbbbbbbbbbbbbbbbbbbbbbbb"},
  "display": {"path": "human_requests/human-request-structural-fixture/display.json", "sha256": "cccccccccccccccccccccccccccccccccccccccccccccccccccccccccccccccc"},
  "card_path": "methods/card.json",
  "probe_paths": ["probes/report.json"],
  "decision_path": "decisions/choice.jsonl",
  "previous_ledger_sha256": null,
  "choices": [{"role": "main", "method_id": "affine-main"}]
}
